,Instructions
211,startseq preheat oven to three hundred and seventy five degrees one hundred and seventy five degrees line baking sheet with parchment paper beat butter and white sugar together in bowl beat with an electric mixer until blended beat in egg and vanilla extract and beat with vanilla extract beat with vanilla extract and vanilla extract beat with ingredients and mix scraping at time into the mixture and mix will be blended stir in chocolate chips and walnuts drop by rounded tablespoonfuls onto greased cookie sheets bake for eight to ten minutes in the preheated oven allow cookies to cool on baking sheet for five minutes before transferring to wire rack to cool completely endseq
269,startseq beat and mix with salt and mix beat and vanilla beat with salt and mix beat and vanilla and mix beat and vanilla combine with baking soda and salt and mix in chocolate chips and mix stir in chocolate chips and mix stir in chocolate chips and mix stir in chocolate chips and mix stir in chocolate chips and mix stir in chocolate chips and mix stir in chocolate chips and mix drop by two tablespoons inches for two inches minutes inches for two inches minutes inches for two inches minutes inches for twelve minutes minutes minutes or or eighteen minutes minutes to cool for ten minutes minutes to cool for ten minutes minutes endseq
16,startseq beat and salt and beat with salt and beat beat and vanilla beat with vanilla beat with vanilla and mix beat and vanilla beat with vanilla and mix beat and vanilla beat with salt and mix in with ingredients and mix beat and mix in chocolate chips and place about two inches apart bake at three hundred and seventy five degrees one hundred and seventy five degrees bake or or with set about ten minutes endseq
55,startseq preheat oven to three hundred and fifty degrees one hundred and seventy five degrees grease cookie sheets in large bowl cream together the butter brown sugar and white sugar until smooth beat in the eggs one at time then stir in the vanilla combine the flour baking soda and salt stir into the creamed mixture fold in the chocolate chips drop by rounded teaspoonfuls onto the prepared cookie sheets bake for eight to ten minutes in the preheated oven allow cookies to cool on baking sheet for five minutes before removing to wire rack to cool completely endseq
31,startseq beat and mix in in or using mix using mix using mix using mix using mix using mix using mix using mix using mix using mix using mix using mix using mix using mix beat in in large mix until mix or or until mix fold in chocolate chips and mix roll in in in large roll by tablespoon onto in in in in in or roll in in or roll in in in in in in in in in in in in in in in in in in in in in in in in in in in in in in in in in in in in in in in in in in in in in in in in in in in in in in in in in in in in in in in in in in in in in in in in in in in in in in in in in in in in in in in in in in in in in in in in in in in in in in in in in in in in in in in in in in in in in in in in in in in in in in in in in in in in in in in in in in in in in in in in in in in in in in in in in in in in in in in in in in in in in in in in in in in in in in in
